{
  "request": "MR-055",
  "status": "submitted",
  "quality": "A",
  "files": [
    {
      "name": "ryan-clip-frame-medium.png",
      "kind": "image",
      "role": "main",
      "duration_s": null,
      "width": 1920,
      "height": 1080,
      "notes": "Redo 2026-10-30: both eyes open, neutral expression, no wink; chest-up framing as generated"
    },
    {
      "name": "ryan-clip-frame-fullbody.png",
      "kind": "image",
      "role": "main",
      "duration_s": null,
      "width": 1920,
      "height": 1080,
      "notes": "Redo 2026-10-30: both eyes open, neutral expression, no wink; full-body proportions matching MR-053 turnaround"
    }
  ],
  "tool": "Meta Muse",
  "model": "Muse Image",
  "prompt_used": "Premium stylized 3D animation style like a modern animated feature film, same man as in the reference avatar (library/style/ref-3d-ryan-01.jpg): young Vietnamese man, short spiky black hair, round friendly face, brown eyes, wearing a plain grey crew-neck tee. Medium shot and full-body shot, standing in a relaxed neutral pose facing camera, both eyes open, calm neutral facial expression, no wink, no smile, centered, wide 16:9 frame, solid flat chroma green background, even soft lighting, no text. Generated at 2048x1152 then resized to exactly 1920x1080 with Lanczos, no distortion.",
  "attempts": 1,
  "self_check": {
    "dung_mau": true,
    "khong_chu": true,
    "khung_dau_cuoi_trung": true,
    "nen_phang": true,
    "mo_ca_hai_mat": true,
    "mat_trung_tinh": true
  },
  "issues": [
    "Redo replaces the earlier wink version submitted in PR #26: new frames have both eyes open and a neutral expression, as instructed 2026-10-30.",
    "Green is flat within each image but close to, not exactly, #00B140; measured corners in meta generation step.",
    "Medium shot as generated is chest-up rather than waist-up; recorded here, not guessed as waist-up."
  ],
  "license": "Meta-Muse-Output",
  "created": "2026-10-30"
}