{
  "request": "MR-038",
  "status": "submitted",
  "quality": "A",
  "files": [
    {
      "name": "loop-du-lieu.mp4",
      "kind": "video",
      "role": "main",
      "duration_s": 7.97,
      "width": 1920,
      "height": 1080,
      "notes": ""
    }
  ],
  "tool": "Meta Muse",
  "model": "Muse (programmatic loop, PIL + ffmpeg)",
  "prompt_used": "Premium stylized 3D animation style like a modern animated feature film, matching library/style/ref-3d-ryan-01.jpg. Seamless looping motion background, abstract flowing data lines and dots moving left to right, calm, no text, no people, last frame matches first frame for a perfect loop.",
  "attempts": 1,
  "self_check": {
    "khung_dau_cuoi_trung": true,
    "dung_mau": true,
    "nen_phang": true,
    "khong_chu": true
  },
  "issues": [
    "Programmatically drawn in PIL: warm cream background, soft blue dashed data lines and dots drifting left to right, 120 frames forward then reversed (ping-pong) so first frame equals last frame, encoded H.264 1920x1080 30fps, no audio, 239 frames = 7.97s. Measured first-vs-last frame mean difference 0.20/255 (codec only)."
  ],
  "license": "Meta-Muse-Output",
  "created": "2026-10-30"
}