{
  "request": "MR-046",
  "status": "submitted",
  "quality": "A",
  "files": [
    {
      "name": "vy-3d-variant-a.png",
      "kind": "image",
      "role": "main",
      "duration_s": null,
      "width": 1280,
      "height": 2048,
      "notes": ""
    },
    {
      "name": "vy-3d-variant-b.png",
      "kind": "image",
      "role": "main",
      "duration_s": null,
      "width": 1584,
      "height": 2048,
      "notes": ""
    },
    {
      "name": "vy-3d-variant-c.png",
      "kind": "image",
      "role": "main",
      "duration_s": null,
      "width": 1584,
      "height": 2048,
      "notes": ""
    }
  ],
  "tool": "Meta Muse",
  "model": "Muse Image",
  "prompt_used": "Premium stylized 3D animation style like a modern animated feature film (soft clay-like shading, subsurface skin, smooth rounded forms, big expressive eyes, soft global illumination, warm cozy color palette, gentle depth of field), matching library/style/ref-3d-ryan-01.jpg. Full-body character design of Vy — woman, about 24, the lively curious office worker who learns. Brown high ponytail with a yellow polka-dot bow, coral cardigan over a white collared shirt, blue pleated skirt, staff ID badge, bright amber eyes, energetic. Keep identity from the 2D design. Neutral relaxed standing pose facing camera, warm friendly expression. Clean neutral light-grey studio background. Do NOT copy the face of the person in the style reference — only its rendering style.",
  "attempts": 1,
  "self_check": {
    "dung_mau": true,
    "khong_chu": true,
    "khung_dau_cuoi_trung": true,
    "nen_phang": true
  },
  "issues": [
    "3 full-body front variants from Vy 2D neutral plus Ryan 3D style reference (style only, face NOT copied). Variant A: coral cardigan open, arms relaxed. Variant B: coral cardigan buttoned, hands clasped, chibi proportions. Variant C: coral cardigan open, waving greeting. All keep brown high ponytail, yellow polka-dot bow, coral cardigan, white collared shirt, blue pleated skirt, staff ID badge, amber eyes. All generated below 2048 px height (A 1280x1920, B/C 1584x1616), so all were padded vertically with their own light-grey background colour to 2048 px height (no resizing, no distortion, no cropping)."
  ],
  "license": "Meta-Muse-Output",
  "created": "2026-10-30"
}